Timestamp,What is the name of your company?,Does your company have specific language requirements for this position? [English],Does your company have specific language requirements for this position? [Spanish],Does your company have specific language requirements for this position? [Portuguese],Does your company have specific language requirements for this position? [French],Does your company have specific language requirements for this position? [Dutch],Does your company have specific language requirements for this position? [Catalan],Where will this position be located?,"Regarding remote working, how many days a week could the employee work off site?","On a scale from 1 to 10, how much time will the employee be spending working on back end and front end?","Aside from the ones covered in our curriculum (MERN Stack), are there additional specific hard-skills you would value in an employee? [Java]","Aside from the ones covered in our curriculum (MERN Stack), are there additional specific hard-skills you would value in an employee? [C# / ASP.net]","Aside from the ones covered in our curriculum (MERN Stack), are there additional specific hard-skills you would value in an employee? [Python]","Aside from the ones covered in our curriculum (MERN Stack), are there additional specific hard-skills you would value in an employee? [PHP]","Aside from the ones covered in our curriculum (MERN Stack), are there additional specific hard-skills you would value in an employee? [SQL]","Aside from the ones covered in our curriculum (MERN Stack), are there additional specific hard-skills you would value in an employee? [Angular (Typescript generation)]","Aside from the ones covered in our curriculum (MERN Stack), are there additional specific hard-skills you would value in an employee? [Vue]","Aside from the ones covered in our curriculum (MERN Stack), are there additional specific hard-skills you would value in an employee? [Firebase]","Aside from the ones covered in our curriculum (MERN Stack), are there additional specific hard-skills you would value in an employee? [AWS]","Aside from the ones covered in our curriculum (MERN Stack), are there additional specific hard-skills you would value in an employee? [Docker / Kubernetes]","Aside from the ones covered in our curriculum (MERN Stack), are there additional specific hard-skills you would value in an employee? [Design Tools (Photoshop, Illustrator...)]","From this list, please rank these 3 soft skills in order of importance for this position [Motivation and ability to overcome problems: employee has a passionate, can-do attitude and proactively looks for solutions to every problem they encounter]","From this list, please rank these 3 soft skills in order of importance for this position [Coachability: Employee is receptive and actively listens and acts on feedback received]","From this list, please rank these 3 soft skills in order of importance for this position [Teamwork: Employee is able to receive and provide value in a team environment]"
3/27/2019 18:14:04,FAKE,Can work in full capacity in this language,Can work in full capacity in this language,No need,No need,No need,No need,In the country where the campus is located,1-2 Days a week,10,No Need,No Need,Nice to have: They should have a basic knowledge,No Need,No Need,No Need,No Need,No Need,Nice to have: They should have a basic knowledge,Nice to have: They should have a basic knowledge,No Need,3,2,1
3/27/2019 18:14:42,FAKE II,No need,Must be able to read basic documentation,No need,No need,No need,No need,In a city in another country,100% office-based job. We're not keen on remote working.,4,No Need,No Need,No Need,Nice to have: They should have a basic knowledge,Nice to have: They should have a basic knowledge,Nice to have: They should have a basic knowledge,No Need,No Need,No Need,No Need,No Need,1,2,3
3/28/2019 17:28:22,Movetia,No need,Can work in full capacity in this language,No need,No need,No need,Must be able to read basic documentation,In the country where the campus is located,100% office-based job. We're not keen on remote working.,5,Must have: Must be able to work with the technology on a regular basis,Nice to have: They should have a basic knowledge,Nice to have: They should have a basic knowledge,Nice to have: They should have a basic knowledge,Must have: Must be able to work with the technology on a regular basis,Nice to have: They should have a basic knowledge,Must have: Must be able to work with the technology on a regular basis,Must have: Must be able to work with the technology on a regular basis,Nice to have: They should have a basic knowledge,Nice to have: They should have a basic knowledge,Must have: Must be able to work with the technology on a regular basis,3,2,1
3/29/2019 9:52:29,Exoticca,Must be able to read documentation and communicate in a meeting,Must be able to read documentation and communicate in a meeting,No need,No need,No need,No need,In the city where the campus is located,1-2 Days a week,6,Must have: Must be able to work with the technology on a regular basis,Nice to have: They should have a basic knowledge,Nice to have: They should have a basic knowledge,Must have: Must be able to work with the technology on a regular basis,Nice to have: They should have a basic knowledge,Nice to have: They should have a basic knowledge,Nice to have: They should have a basic knowledge,Nice to have: They should have a basic knowledge,Nice to have: They should have a basic knowledge,Nice to have: They should have a basic knowledge,Nice to have: They should have a basic knowledge,1,3,2
3/29/2019 14:22:57,The Hotels Network,Must be able to read documentation and communicate in a meeting,Must be able to read documentation and communicate in a meeting,No need,No need,No need,No need,In the city where the campus is located,1-2 Days a week,5,No Need,No Need,Nice to have: They should have a basic knowledge,Must have: Must be able to work with the technology on a regular basis,Nice to have: They should have a basic knowledge,No Need,Nice to have: They should have a basic knowledge,No Need,Nice to have: They should have a basic knowledge,Nice to have: They should have a basic knowledge,Nice to have: They should have a basic knowledge,2,3,1
4/1/2019 12:44:48,Company ALL MAX,Can work in full capacity in this language,Can work in full capacity in this language,Can work in full capacity in this language,Can work in full capacity in this language,Can work in full capacity in this language,Can work in full capacity in this language,In a city in another country,100% remote-based job. No physical office.,10,Must have: Must be able to work with the technology on a regular basis,Must have: Must be able to work with the technology on a regular basis,Must have: Must be able to work with the technology on a regular basis,Must have: Must be able to work with the technology on a regular basis,Must have: Must be able to work with the technology on a regular basis,Must have: Must be able to work with the technology on a regular basis,Must have: Must be able to work with the technology on a regular basis,Must have: Must be able to work with the technology on a regular basis,Must have: Must be able to work with the technology on a regular basis,Must have: Must be able to work with the technology on a regular basis,Must have: Must be able to work with the technology on a regular basis,3,2,1
4/1/2019 12:45:31,Company ALL MIN,No need,No need,No need,No need,No need,No need,In the city where the campus is located,100% office-based job. We're not keen on remote working.,1,No Need,No Need,No Need,No Need,No Need,No Need,No Need,No Need,No Need,No Need,No Need,1,2,3
4/1/2019 12:46:17,Company ALL MID,Must be able to read documentation and have an informal conversation,Must be able to read documentation and have an informal conversation,Must be able to read documentation and have an informal conversation,Must be able to read documentation and have an informal conversation,Must be able to read documentation and have an informal conversation,Must be able to read documentation and have an informal conversation,In the country where the campus is located,3+ Days. It's up to the employee,5,Nice to have: They should have a basic knowledge,Nice to have: They should have a basic knowledge,Nice to have: They should have a basic knowledge,Nice to have: They should have a basic knowledge,Nice to have: They should have a basic knowledge,Nice to have: They should have a basic knowledge,Nice to have: They should have a basic knowledge,Nice to have: They should have a basic knowledge,Nice to have: They should have a basic knowledge,Nice to have: They should have a basic knowledge,Nice to have: They should have a basic knowledge,2,1,3